id,created_at,text
1063808384422608897,2018-11-17 14:57:38,"b'@redbeardeddevil Hi Stacy, that route is seasonal and will not be operating for the remainder of the year after Nov\xe2\x80\xa6 https://t.co/gFZpZYLUCU'"
1063544624604684289,2018-11-16 21:29:32,b'\xf0\x9f\x91\x80\xe2\x9d\xa4\xef\xb8\x8f https://t.co/shIQgTaPBa'
1063543649655500801,2018-11-16 21:25:40,"b'@tnduchess Hi Lisa, is there anything the Social Media Team can assist with? - Jules'"
1063542288989765633,2018-11-16 21:20:16,"b'RT @usatodaytravel: .@Allegiant revealed plans for 10 new nonstop routes and a major expansion in Sarasota, Florida: https://t.co/7iADyFXooB'"
1063538016717864960,2018-11-16 21:03:17,"b""Tonight we're taking over the plaza at @TMobileArena to watch our hometown team, @GoldenKnights take on #StLouis!\xe2\x80\xa6 https://t.co/IUz5eYaMP1"""
1063521132840660992,2018-11-16 19:56:11,"b'@dpreston2020 @MobileAeroplex HI David, we love the suggestion! While we do not have immediate plans to offer your\xe2\x80\xa6 https://t.co/ims7n43A1A'"
1063520778006745089,2018-11-16 19:54:47,"b'@angeo423 Hi Angie, we apologize. It is stated on your itinerary to please arrive 2 hours prior to departure. We ha\xe2\x80\xa6 https://t.co/IseTtaS95s'"
1063481366233456641,2018-11-16 17:18:10,b'@MatthewFata This is the case if your print at the airport. You can download our mobile app or print your boarding\xe2\x80\xa6 https://t.co/IlIX1Krh41'
1063481101287636993,2018-11-16 17:17:07,b'@IamLaurenBenoit Please send us a DM with your confirmation number and email address on file. - Jules https://t.co/Jqv4zgBl3R'
1063478988012773376,2018-11-16 17:08:43,"b'@IamLaurenBenoit Hi Lauren, are you already at the airport? - Jules'"
1063467020275068930,2018-11-16 16:21:10,b'@IJustBarted My pleasure Bart! - Jules'
1063460967676301313,2018-11-16 15:57:07,"b'@IJustBarted Hi Bart, checked bag tags must be printed at the airport. There is no fee for doing so. However, if yo\xe2\x80\xa6 https://t.co/kuO0K8asoY'"
1063451113863737348,2018-11-16 15:17:58,"b'@RedXtreme Hi Tim, thanks for reaching out! We apologize for the delay. Our Social Media Team is not available 24/7\xe2\x80\xa6 https://t.co/U0dd6oXGCK'"
1063240407985909762,2018-11-16 01:20:41,"b'@salvationworks4 Hello Josh, So very sorry to hear of your family emergency. Can you send us a DM with your itinera\xe2\x80\xa6 https://t.co/L2Oa3N8n1U'"
1063224504736976897,2018-11-16 00:17:30,"b'@natcadude We do apologize, that is not correct. Can you also provide your flight number so we can look at the details. -Bree'"
1063222469811671041,2018-11-16 00:09:25,b'@natcadude *to (my apologies) -Bree'
1063222291339853824,2018-11-16 00:08:42,"b""@natcadude I do apologize for the confusion. Electronics don't always work the way we need them do. Our teams are w\xe2\x80\xa6 https://t.co/3eGG1r3sgm"""
1063220588100182018,2018-11-16 00:01:56,b'@walkersimasek If you send us a DM with your itinerary number and email address we can take a look. -Bree https://t.co/UuUZFVX0hS'
1063219752984825856,2018-11-15 23:58:37,"b'@RedXtreme Hi Tim, We apologize for the confusion, the crew did not forget paperwork. It does look like flight 2187\xe2\x80\xa6 https://t.co/sK5fcBeWOP'"
1063219430497357824,2018-11-15 23:57:20,"b'@walkersimasek Hello Walker, we do apologize for the delay, as of now, it is not system wide. Can you advise your f\xe2\x80\xa6 https://t.co/SUTietPTv6'"
1063219092235214848,2018-11-15 23:55:59,"b'@natcadude Hello Brian, As of now, it is not system wide, as not all flights are affected. We do apologize for the delay. -Bree'"
1063215522022596608,2018-11-15 23:41:48,"b'@RedXtreme Tim, We do apologize for the delay and thank you for your patience. As you know, electronics dont always\xe2\x80\xa6 https://t.co/tfSGUKrQ3U'"
1063197497588412416,2018-11-15 22:30:11,"b'@jrjsharrell @SouthwestAir Jeny, We are very sorry to hear of your frustrations. We do advise all passengers to arr\xe2\x80\xa6 https://t.co/wBAiY9k6E4'"
1063189981496262657,2018-11-15 22:00:19,"b'@melaniespencer Hi Melanie, thanks for reaching out! That flight is experiencing an approximate 2 hour and 27 minut\xe2\x80\xa6 https://t.co/EGmVtLRU4p'"
1063172336906575874,2018-11-15 20:50:12,"b'@DarthAbith We apologize for this inconvenience. Safety is at the core of our operation - every flight, every day.\xe2\x80\xa6 https://t.co/6rDMx65NtZ'"
1063171302998052865,2018-11-15 20:46:06,"b'@DarthAbith Hey there, can you provide your flight number so we can take a look into it for you. -Bree'"
1063168004211556352,2018-11-15 20:32:59,b'@Stubberella7 That delay is not due to a system error with our tablets. It is an IT maintenance on the ipad the the\xe2\x80\xa6 https://t.co/ATmWcF95nR'
1063167012900347904,2018-11-15 20:29:03,"b'@Stubberella7 Hi Stephanie, would you please provide us with a flight number so we can take a look? - Jules'"
1063163543346864128,2018-11-15 20:15:16,b'We love a good surprise! \xf0\x9f\x8e\x89\n\nHave you ever surprised someone with a visit? Share your story with us!\n\n#TogetherWeFly https://t.co/KJz4hKyunu'
1063142627103698949,2018-11-15 18:52:09,b'@Stix @23SpeedRacer @ChadFinchum Thank you for choosing Allegiant! :) -Bree'
1063125635013451776,2018-11-15 17:44:37,"b'@PatsSeymour93 Hello Tracy, Can you send us a DM with your itinerary number, email address and details so we can re\xe2\x80\xa6 https://t.co/nT6ZWry1HX'"
1063118852433813504,2018-11-15 17:17:40,"b'@CherTangney Hi Cheryl, we love the suggestion! While we do not have immediate plans to offer your desired route, w\xe2\x80\xa6 https://t.co/eBEiVdefFR'"
1063115320255221761,2018-11-15 17:03:38,"b'@melis43179 Melissa, We do see that our team has responded to your Facebook post. Please be sure to share these det\xe2\x80\xa6 https://t.co/UOcTjei67k'"
1063114938560974848,2018-11-15 17:02:07,"b'@Catheri27007176 Hello Catherine, Thank you for reaching out. Flight 584 was diverted due to weather. -Bree'"
1063114028048936961,2018-11-15 16:58:30,"b'@dgoods32 David, We do apologize for the 4 hour delay, which did start out as maintenance and then was delayed agai\xe2\x80\xa6 https://t.co/UE4BKPBDch'"
1063113451604717568,2018-11-15 16:56:13,"b'@thesistershood Hello there, Please feel free to send us a DM with your itinerary number, email address and request\xe2\x80\xa6 https://t.co/p6HBKXR8EB'"
1063106563899043847,2018-11-15 16:28:51,"b'@dgoods32 Hi David, can you please provide us with your flight number? - Jules'"
1063106361242849281,2018-11-15 16:28:02,"b'@rhondawg67 Hi Rhonda, please send us a DM with your confirmation number and email address on file so we can review\xe2\x80\xa6 https://t.co/Lz3pzK0pLC'"
1063105950301782017,2018-11-15 16:26:24,"b'@jaysonwhelpley @BradBanyard We are unable to determine a specific time. However, our IT department is aware and is\xe2\x80\xa6 https://t.co/3tRfxRPGX2'"
1063100226947428352,2018-11-15 16:03:40,"b'@BradBanyard Hey Brad, we have been experiencing technical difficulties with Apple Wallet. Please use the boarding\xe2\x80\xa6 https://t.co/qmttvXTvGn'"
1063099719096958977,2018-11-15 16:01:39,"b'@BigEisy Hey there, thanks for reaching out! If you are already at the airport, you can add a checked bag at the ticket counter. - Jules'"
1063099563089780736,2018-11-15 16:01:01,"b'@Erin_Lehman Hey Erin, we are very sorry to hear of your frustrations. Is there anything we can assist with? - Jules'"
1062855217300025344,2018-11-14 23:50:05,"b'@erikkusanotaku @SanDiegoAirport Awww So sorry Erick, we will miss them too! -Bree'"
1062815684172886016,2018-11-14 21:12:59,"b'@C3DReminders Hey there, what is the flight number so we can take a look into it? -Bree'"
1062811591840800775,2018-11-14 20:56:44,"b'@NikaLadawn Our Customer Relations Team does respond in the order received. As we are regulated by the DOT, all pas\xe2\x80\xa6 https://t.co/pn9boZusIV'"
1062787223970549760,2018-11-14 19:19:54,"b""Meet Jacqueline! She's one of our amazing flight attendants, working hard to get you to your favorite travel destin\xe2\x80\xa6 https://t.co/aDg1TVY71z"""
1062759051849818112,2018-11-14 17:27:57,"b'@JennyMominFL Hello Jennifer, Yes, the Allegiant Honors program does extend to Veterans/retired. as shown on the website. -Bree'"
1062758268051906562,2018-11-14 17:24:50,"b'@mrjasonzink @Orioles Hey there, we have updated out calendar and now include flight through August 13. This flight\xe2\x80\xa6 https://t.co/BgfpAcyILL'"
1062735562363359232,2018-11-14 15:54:37,"b'@JennyMominFL Hey Jennifer, can you please clarify what new military perks you are referring to? - Jules'"
1062731769802379265,2018-11-14 15:39:33,b'@NikaLadawn We are very sorry you feel that way. We never want our passengers to feel that their concern does not m\xe2\x80\xa6 https://t.co/U0OAtrRvNd'
1062489304646275073,2018-11-13 23:36:04,"b'@NikaLadawn Hello there, very sorry to hear of your frustrating experience. Feel free to submit your request in wri\xe2\x80\xa6 https://t.co/2fM0wnnEDI'"
1062474798645813248,2018-11-13 22:38:26,"b'@greggarrett1979 @iwfmh Thank you for your loyalty, we look forward to welcoming you on board again soon! -Bree'"
1062433503541977088,2018-11-13 19:54:20,"b'@MaryBethBlanch5 @couponfollow Hello MaryBeth, as a low cost carrier we do not have coupon codes. Sorry to disappoint! -Bree'"
1062430832269447169,2018-11-13 19:43:44,"b'@verityfigament Hey, you never know! ^KS'"
1062430709162352641,2018-11-13 19:43:14,"b'RT @FlyHIA: Starting April 3, 2019, @Allegiant will begin non-stop service from @FlyHIA to @SRQAirport twice weekly to add to their increas\xe2\x80\xa6'"
1062430665432543232,2018-11-13 19:43:04,"b'RT @RickIntlAirport: NEWS: @Allegiant announced twice-weekly, nonstop flights between Rickenbacker and Sarasota begin April 4! https://t.co\xe2\x80\xa6'"
1062427083081728002,2018-11-13 19:28:50,"b'RT @SundeWFLAWeb: MORE FLIGHTS! @Allegiant adds 9 nonstop routes at Sarasota-Bradenton Intl Airport, introductory prices $45 and up. https:\xe2\x80\xa6'"
1062426730797907971,2018-11-13 19:27:26,b'RT @TylerCoolGuy88: New route out of @FlyHIA has been confirmed with @Allegiant. https://t.co/Yd3QhzFeRv'
1062426644445564928,2018-11-13 19:27:05,b'RT @0504Traveller: @Allegiant to begin nonstop flights from @FlyLouisville to @NO_Airport #NewOrleans #MSY\nhttps://t.co/N0K4HwiFtc'
1062426450572296196,2018-11-13 19:26:19,b'@greghow89287352 @WLOSKaren @flyavlnow @WLOS_13 They sure do! Hope to welcome you aboard soon! ^KS'
1062425943225102336,2018-11-13 19:24:18,"b'RT @lauraefinaldi: STORY: @Allegiant announced nine new year-round destinations out of Sarasota-Bradenton International Airport, one of the\xe2\x80\xa6'"
1062414135806304261,2018-11-13 18:37:23,"b""BIG NEWS! \xf0\x9f\x8e\x89\n\nWe're proud to announce 9 new routes to #Sarasota! Plus, we've added a new nonstop seasonal service be\xe2\x80\xa6 https://t.co/X6mkMJB3K1"""
1062392414588022785,2018-11-13 17:11:04,"b'@ExecChef Hey there, yes they are! (And boy am I glad, its my daughters favorite thing to play on!) -Bree'"
1062388787580489728,2018-11-13 16:56:39,"b'@DirtyDeeds30 Hey Nick, in order to take advantage of the Buy One Get One airfare for our Allegiant World MasterCar\xe2\x80\xa6 https://t.co/zrvDSkn2GO'"
1062375808847757315,2018-11-13 16:05:05,b'@K8Esturg_ Hey Katie - Thanks for reaching out! We are very sorry to hear about your travel experience. Please send\xe2\x80\xa6 https://t.co/8TdV6JNC6J'
1062371696248799232,2018-11-13 15:48:44,b'@djschny Great! We cannot wait to welcome you on board. - Jules'
1062368479943241728,2018-11-13 15:35:58,b'@ToniFoxx That route is on hiatus until February 15. We do apologize for the inconvenience. - Jules'
1062366452806832133,2018-11-13 15:27:54,"b'@ToniFoxx Hi Toni, you may be looking at a route that is seasonal or on hiatus. - Jules'"
1062365925427548160,2018-11-13 15:25:49,"b'@terrefirmaTerre Hi Terre, we are very glad that your check in experience went well! We do strive for quality custo\xe2\x80\xa6 https://t.co/yu1FrPKKa8'"
1062365503912591360,2018-11-13 15:24:08,"b'@fleetwitchmac Hi there, that route is seasonal. Please check back at the end of the year for dates into Summer 2019! - Jules'"
1062364933189521409,2018-11-13 15:21:52,"b'@djschny Hi Ryan, we apologize for the delay, Are you still experiencing difficulty booking? - Jules'"
1062364801656123392,2018-11-13 15:21:21,"b'@martianmarshall Hi Marshall, it looks like we have responded to your DM. - Jules'"
1062188982270861312,2018-11-13 03:42:42,b'@strimby you got! Thank you for your patience. -Terrance'
1062188836376207361,2018-11-13 03:42:07,b'@copumpkin Hi! We are performing a planned system update that may have interfered with your purchase. Please try ag\xe2\x80\xa6 https://t.co/62d265xzwT'
1062185317019672576,2018-11-13 03:28:08,b'@strimby Hi! We are performing a planned system update that may have interfered with your purchase. Please try agai\xe2\x80\xa6 https://t.co/HA4sEe4ofq'
1062167502749351937,2018-11-13 02:17:21,"b""@SirCastor we're sorry to hear that. We provide travel for a lot of people that may not be able to afford to travel\xe2\x80\xa6 https://t.co/CSWnSEg2M4"""
1062165230493548551,2018-11-13 02:08:19,"b'@SirCastor Thanks for your feedback Glenn, we will work to be better and we thank you for choosing Allegiant. -Terrance'"
1062162961568030720,2018-11-13 01:59:18,"b'@SirCastor Hi Glenn, we apologize for the disruption to your travels. Our ticket agents also assist at the gate as\xe2\x80\xa6 https://t.co/PDB9pCTiYK'"
1062156673022918656,2018-11-13 01:34:19,"b""@R_smith28 Hi there Ryan, thanks for reaching out! We advise that you visit our 'Deals' page to get the best bargai\xe2\x80\xa6 https://t.co/5TJSH6k4GH"""
1062121912564822016,2018-11-12 23:16:11,"b'@23_LDM Hello Linda, We are very sorry to hear of your frustrations. Can you send us a DM with your itinerary numbe\xe2\x80\xa6 https://t.co/ICEjY6f8RQ'"
1062112103786536960,2018-11-12 22:37:13,b'@staybloodred Thank you for your service and thank you for choosing Allegiant! -Bree'
1062111899028983808,2018-11-12 22:36:24,b'@Jpernaa14 Hey there we service charter flights that service airports that are not on our daily schedule. :) -Bree'
1062109029722439681,2018-11-12 22:25:00,"b'@martianmarshall Hello there, we are very sorry for any confusion. It is stated in our Terms &amp; Conditions, accepted\xe2\x80\xa6 https://t.co/LqU28yS7LD'"
1062089303944249345,2018-11-12 21:06:37,"b""@lmz199 No problem Lisa! That's what we're here for. Thank you for allowing us to assist and thank you for choosing Allegiant! -Terrance"""
1062083900288188416,2018-11-12 20:45:09,"b'@fournier_gerard our agents are assisting at the gate for Flight 1758, once that flight takes off they will be back\xe2\x80\xa6 https://t.co/cOWXsImkXN'"
1062082851317915649,2018-11-12 20:40:58,"b'@fournier_gerard Perfect, I will check on this for you now. Thank you for your patience. -Terrance'"
1062082078827835392,2018-11-12 20:37:54,"b'@fournier_gerard Hi Gerard, can you provide me with your flight number so I can better assist and supply you with an update? -Terrance'"
1062081884467933185,2018-11-12 20:37:08,"b'@lmz199 Hi Lisa, thank you for reaching out and sorry for the long hold time. Can you send us a DM with your confir\xe2\x80\xa6 https://t.co/KapinpJ3Kz'"
1062060935676862465,2018-11-12 19:13:53,"b'@IndianaCabin Hello there, We are sorry to hear of your frustrations. Can you please send us a DM with your itinera\xe2\x80\xa6 https://t.co/Zb4pbNBCfs'"
1062047122583896064,2018-11-12 18:19:00,b'Our VIP PBR Vegas Experience winners had a great time this weekend at the 25th @PBR World Finals: Unleash The Beast\xe2\x80\xa6 https://t.co/e9LN5uIENR'
1062042663904595974,2018-11-12 18:01:17,b'@Cups_and_Caykes We do suggest checking back at the end of the year when we release our Summer 2019 calendar! - Jules'
1062042207996313600,2018-11-12 17:59:28,"b'@lilybondi @LVGully Hi Elizabeth, we would love for you to take advantage of our low fares. We have included a link\xe2\x80\xa6 https://t.co/5LGjmpXqYt'"
1062041860905099264,2018-11-12 17:58:06,"b""@LVGully Hi Scott, we are so very sorry to hear about your son's delay. Please send us a DM with your confirmation\xe2\x80\xa6 https://t.co/z9TTjArjwc"""
1062041364114952193,2018-11-12 17:56:07,"b'@nycki96 Yes. You can bring a personal item, medical bag, as well as a carry on. - Jules'"
1062041171147534336,2018-11-12 17:55:21,"b'@sincitykid27 Hi Kolton, have you had a recent flight delay that you would like us to address? - Jules'"
1062040308928692225,2018-11-12 17:51:56,"b'@brooke_harris18 Hi Brooke, do you need assistance? - Jules'"
1062040141726973952,2018-11-12 17:51:16,b'@Cups_and_Caykes Thanks for the inquiry Kate! We are thrilled that you travel with us so often. We hope to keep tra\xe2\x80\xa6 https://t.co/3nZTjiDIHT'
1062039537965301766,2018-11-12 17:48:52,"b'@JodiCab Hi there, we are currently experiencing a very high call volume. Would you please send us a DM with your c\xe2\x80\xa6 https://t.co/psam4l0Lzk'"
1062038609421844480,2018-11-12 17:45:10,"b'@Cups_and_Caykes Hi Kate, as we are an ultra low cost carrier, we will not be offering Black Friday deals. We do ap\xe2\x80\xa6 https://t.co/TysTO56jxy'"
1062020014826500096,2018-11-12 16:31:17,b'@LVGully @TerranceJamesII Very sorry for the frustrating delay. We strive to get all of our passengers to their des\xe2\x80\xa6 https://t.co/xJu6050qKG'
1062019723041349632,2018-11-12 16:30:08,"b'@JennaRoseRod Jenna,We are very sorry to hear of the frustration,we do apologize for the delay. We strive to get al\xe2\x80\xa6 https://t.co/iU73Lk1hMM'"
1062019243737255937,2018-11-12 16:28:13,"b'@stcychng Hello there,  Can you send us a DM with your itinerary number and email address so we can take a look int\xe2\x80\xa6 https://t.co/zqg9kvaaK6'"
1062018671449686018,2018-11-12 16:25:57,"b'@TheMsRuiz Cynthia, We do apologize for the long hold times, please feel free to send us a DM with your itinerary n\xe2\x80\xa6 https://t.co/HlYgtvjFqV'"
1062018556769038343,2018-11-12 16:25:29,"b'@TheMsRuiz Cynthia, We do apologize for the long hold times, please feel free to send us a DM with your itinerary n\xe2\x80\xa6 https://t.co/nFqK24on9d'"
1061798135310245889,2018-11-12 01:49:37,b'@rrauscher Hi Richard thank you for reaching out. Can you please send us a DM with a screenshot of the email please\xe2\x80\xa6 https://t.co/QOvrEam8Bj'
1061794401788276736,2018-11-12 01:34:47,"b'@princess_cook90 Hi there Holly, thank you for reaching out. Flight 1620 is set for a 6:40 a.m. departure! -Terrance'"
1061724951789662209,2018-11-11 20:58:49,b'@SergeH007 I do apologize for the frustration of the delay. The inbound aircraft had passengers that needed oxygen(\xe2\x80\xa6 https://t.co/8UtA04n7Oo'
1061723713677213696,2018-11-11 20:53:53,"b""@_xoxo_kylie_ Kylie -we do apologize for the delay, it is due to the aircraft's inbound flight had passengers who n\xe2\x80\xa6 https://t.co/vsMKJXz55i"""
1061723519497785344,2018-11-11 20:53:07,b'@SergeH007 Flight 338 from LAX to BOI has flown and been completed. Is it maybe a different flight number?'
1061723255847960576,2018-11-11 20:52:04,"b'@Memajority Hey there, what is your fight number so we can take a look? -Bree'"
1061722938523742210,2018-11-11 20:50:49,"b'@JeffGucciardo Thank you Jeff, we do apologize for the delay, it is due to the aircrafts inbound flight had passeng\xe2\x80\xa6 https://t.co/5LfVZkaoVc'"
1061722701314904070,2018-11-11 20:49:52,"b'@_xoxo_kylie_ Kylie, Can you please provide your flight number so we can review the details. -Bree'"
1061710752833302528,2018-11-11 20:02:23,"b'@JeffGucciardo Jeff, Very sorry to hear of the frustrations. Can you please provide your flight number so we can take a look into it. -Bree'"
1061707182734012417,2018-11-11 19:48:12,"b'@SergeH007 Hello Serge, Can you provide us your flight number to review? -Bree'"
1061707044909170689,2018-11-11 19:47:39,"b'@megsk12 Hello Megan, Can you send us a DM with your itinerary number, email address and details of the situation s\xe2\x80\xa6 https://t.co/x72WEBSW3l'"
1061692344020467712,2018-11-11 18:49:14,"b'@YourTravelProf If the airport hours are not listed, it means that specific airport is only available to sell ticke\xe2\x80\xa6 https://t.co/DjEHRpRhUK'"
1061687361183064064,2018-11-11 18:29:26,"b""'Tis the season! Take advantage of these great deals while they last- https://t.co/HrXdTKTov1! #TogetherWeFly https://t.co/lLxFuVQZba"""
1061685887073968128,2018-11-11 18:23:35,"b'@YourTravelProf Hey there, very sorry for any frustration or confusion. The carrier usage fee is applied to all air\xe2\x80\xa6 https://t.co/KRMK1nOgmV'"
1061677747465011200,2018-11-11 17:51:14,b'@KellySenatra We do apologize for the frustration. Our team has arranged for another aircraft to come in for your f\xe2\x80\xa6 https://t.co/xPNGWdlsz5'
1061677112493518849,2018-11-11 17:48:43,"b'@BradyBadly Very sorry for the delay, can you please send us a DM with your itinerary number and email address. Tha\xe2\x80\xa6 https://t.co/grsUy9ehOg'"
1061675871218659330,2018-11-11 17:43:47,"b'@BradyBadly Hello there, what is your flight number, we can take a look into it for you. -Bree'"
1061674324053106689,2018-11-11 17:37:38,"b'@nycki96 Hey Nicki, Each passenger is allowed on personal item at no charge, does have to fit dimensions of 7x15x16\xe2\x80\xa6 https://t.co/ti7kZytbHj'"
1061659055968665600,2018-11-11 16:36:58,b'@KellySenatra It is delayed due to maintenance. -Bree'
1061646311395655680,2018-11-11 15:46:19,b'@KellySenatra We apologize for this inconvenience. Flight 2181 is on a delay due to the incoming flight operating o\xe2\x80\xa6 https://t.co/ucCnJMSF7h'
1061645223254781952,2018-11-11 15:42:00,"b'@LilGriggs Of course, very sorry to hear you had to experience maintenance delay on your outbound flight. Thank you for your patience.'"
1061645053746126849,2018-11-11 15:41:19,"b'@thevanishingdot Hello Kay, we have requested she send us her details via DM so we can review. Thank you for reaching out. -Bree'"
1061644888738029569,2018-11-11 15:40:40,"b'@chocopuffin_ Hello there, sorry to hear of your frustration. Can you send us a DM with your itinerary number and e\xe2\x80\xa6 https://t.co/0Yv1eq6JPH'"
1061644716847046656,2018-11-11 15:39:59,"b'@LilGriggs Hey there, our Social media team is not 24/7 (yet) we did response to your previous tweet. You can alway\xe2\x80\xa6 https://t.co/Ml6IclRHsE'"
1061644493634629633,2018-11-11 15:39:06,"b'@KellySenatra Hello there, can you provide your flight number so we can take a look into it for you?-Bree'"
1061644367813922816,2018-11-11 15:38:36,"b'@LilGriggs Hey there, flight 585 is delayed do the weather on incoming flight, we do apologize that the weather has\xe2\x80\xa6 https://t.co/98QqAO7H6C'"
1061419916111294465,2018-11-11 00:46:42,"b'@Alexhawj7 Hi there Alex, we can definitely assist with this! Can you send us a DM with your confirmation number an\xe2\x80\xa6 https://t.co/kUCQpDks39'"
1061396783908163584,2018-11-10 23:14:47,"b'@MoniBellaPhoto Hi Monica, that route goes on hiatus November 27 and will return March 7. We do apologize for the inconvenience. - Jules'"
1061348430541438976,2018-11-10 20:02:39,"b'@DeeKTheFreaK Hi Deek, we apologize for any disruption to your trip. If you would like further assistance please se\xe2\x80\xa6 https://t.co/DdIqcZHL4V'"
1061347281537064960,2018-11-10 19:58:05,b'@king_guthrum Hey there - We apologize for any confusion. It is stated on your boarding pass to arrive 2 hours prio\xe2\x80\xa6 https://t.co/PherC9se4T'
1061337457189371910,2018-11-10 19:19:03,b'@stevenmgroves We are so excited to travel with you!! - Jules'
1061335573040906240,2018-11-10 19:11:33,"b'@MichaelPramawat Hey Michael, we are very sorry for the delay. Please send us a DM with your confirmation number an\xe2\x80\xa6 https://t.co/7ek4UuY0HP'"
1061332890552799234,2018-11-10 19:00:54,b'Grab your best friend and head out on an adventure today! #TogetherWeFly https://t.co/Njvxwu32Yh'
1061301538977734658,2018-11-10 16:56:19,"b'@theritzman Hey Michael, please send us a DM with your confirmation number and email address on file so we can look\xe2\x80\xa6 https://t.co/Sm4tf8rwcY'"
1061285303074328577,2018-11-10 15:51:48,b'@jessiesgirl510 Hey Brandy - Thanks for reaching out! We apologize for the delay. Our Social Media Team is not avai\xe2\x80\xa6 https://t.co/AG6kdfERI3'
1061014896056393728,2018-11-09 21:57:18,"b'@DavidDrewek Hey David, that flight is delayed approximately 40 minutes due to maintenance. We apologize for this i\xe2\x80\xa6 https://t.co/4pqLRqDv3R'"
1061007940067516417,2018-11-09 21:29:40,"b'@rileyjwagner Hey there, please send us a DM with the confirmation number and email address on file. We will be hap\xe2\x80\xa6 https://t.co/ywNhJs5JQf'"
1060981837290446848,2018-11-09 19:45:56,"b'@indigocl Hey Indigo, looks like we responded to your private message. In effort to keep communication consistent,\xe2\x80\xa6 https://t.co/xlNaGYjnuX'"
1060940421700968450,2018-11-09 17:01:22,"b""Not that there's ever a bad time to go to Austin but...\xe2\xac\x87\xef\xb8\x8f\n\nRead more here: https://t.co/uH4rMu5dQP.\n\n#TogetherWeFly https://t.co/Ka1n2QKKQP"""
1060915834758017025,2018-11-09 15:23:40,"b'@Alexhawj7 Hey Alex, we apologize for the delay. Do you still need assistance? - Jules'"
1060915611939885056,2018-11-09 15:22:47,"b""@Cbreakout17 Hey Chance, we are very sorry to hear about your wife's travel experience. Do you still need assistance? - Jules"""
1060915398546243584,2018-11-09 15:21:56,"b'@EmilyAMullen Hey Emily, we apologize for any frustrations. It is stated at the time of booking that there is a can\xe2\x80\xa6 https://t.co/L7xuj7ZJ5d'"
1060707256101158912,2018-11-09 01:34:51,"b'@Ciarao_brien Hello Ciara, Can you send us a DM with your itinerary number and email address so we can review those\xe2\x80\xa6 https://t.co/89sp2uhcW9'"
